{
  "events": [
    {
      "approval_policy": "never",
      "codex_home_mode": "isolated",
      "codex_version": "codex-cli 0.142.5",
      "evidence_mode": "final-evidence",
      "global_capability_inventory": {
        "admin_skill_dirs": [
          {
            "entry_count": 0,
            "status": "ABSENT"
          }
        ],
        "bundled_skills": {
          "status": "SYSTEM_MANAGED_UNKNOWN"
        },
        "home_isolated": true,
        "user_skill_dir": {
          "entry_count": 0,
          "status": "ISOLATED_HOME"
        },
        "workspace_skill_dirs": {
          "empty_parent_skill_dirs": 0,
          "mounted_entry_count": 1,
          "parent_skill_dirs_checked": 6,
          "workspace_status": "CLEAR"
        }
      },
      "sandbox": "workspace-write",
      "skill_inventory": {
        "admin_skill_dirs": [
          {
            "entry_count": 0,
            "status": "ABSENT"
          }
        ],
        "bundled_skills": {
          "status": "SYSTEM_MANAGED_UNKNOWN"
        },
        "home_isolated": true,
        "user_skill_dir": {
          "entry_count": 0,
          "status": "ISOLATED_HOME"
        },
        "workspace_skill_dirs": {
          "empty_parent_skill_dirs": 0,
          "mounted_entry_count": 1,
          "parent_skill_dirs_checked": 6,
          "workspace_status": "CLEAR"
        }
      },
      "supports_skip_git_repo_check": true,
      "type": "preflight"
    },
    {
      "original_type": "thread.started",
      "payload": {
        "thread_id": "019f3c22-3bf9-7490-a538-cb1d1593b74c",
        "type": "thread.started"
      },
      "type": "unknown"
    },
    {
      "original_type": "turn.started",
      "payload": {
        "type": "turn.started"
      },
      "type": "unknown"
    },
    {
      "original_type": "item.completed",
      "payload": {
        "item": {
          "id": "item_0",
          "text": "I\u2019ll use the powerlifting skill for the scoring rules, then inspect the workbook/readme to identify the required columns and write formulas into the `Dots` sheet.",
          "type": "agent_message"
        },
        "type": "item.completed"
      },
      "type": "unknown"
    },
    {
      "original_type": "item.started",
      "payload": {
        "item": {
          "aggregated_output": "",
          "command": "/bin/zsh -lc \"sed -n '1,240p' .agents/skills/skillsbench_powerlifting--18cb5a69f69b/SKILL.md && pwd && rg --files [REDACTED] . 2>/dev/null | head -200\"",
          "exit_code": null,
          "id": "item_1",
          "status": "in_progress",
          "type": "command_execution"
        },
        "type": "item.started"
      },
      "type": "unknown"
    },
    {
      "original_type": "item.completed",
      "payload": {
        "item": {
          "aggregated_output": "---\nname: \"powerlifting\"\ndescription: \"Calculating Powerlifting Scores as a Professional Coach\"\n---\n---\nname: powerlifting\ndescription: \"Calculating powerlifting scores to determine the performance of lifters across different weight classes. \"\n---\n\n# Calculating Powerlifting Scores as a Professional Coach\n\n## Dynamic Objective Team Scoring (Dots)\n\nIn the world of powerlifting, comparing lifters across different body weights is essential to /determine relative strength and fairness in competition. This is where the **DOTS score**\u2014short for \u201cDynamic Objective Team Scoring\u201d\u2014comes into play. It\u2019s a widely-used formula that helps level the playing field by standardizing performances regardless of a lifter\u2019s body weight. Whether you\u2019re new to powerlifting or a seasoned competitor, understanding the DOTS score is crucial for evaluating progress and competing effectively.\nThis section is from [powerliftpro](https://powerliftpro.app/understanding-the-dots-score-in-powerlifting-a-comprehensive-guide/).\n\n\n### What is the DOTS Score?\n\nThe DOTS score is a mathematical formula used to normalize powerlifting totals based on a lifter\u2019s body weight. It provides a single number that represents a lifter\u2019s relative strength, allowing for fair comparisons across all weight classes.\n\nThe score takes into account:\n\n- **The lifter's total:** The combined weight lifted in the [squat](https://powerliftpro.app/exercises/low-bar-squat/), [bench press](https://powerliftpro.app/exercises/comp-bench-press/), and [deadlift](https://powerliftpro.app/exercises/conventional-deadlift/).\n- **Body weight:** The lifter\u2019s weight on competition day.\n\n### The DOTS Formula\n\nFor real powerlifting nerds who want to calculate their DOTS longhand (remember to show all work! sorry, old math class joke), the DOTS formula is as follows:\n\nDOTS Score=Total Weight Lifted (kg)\u00d7a+b(BW)+c(BW2)+d(BW3)+e(BW4)500\n\nHere:\n\n- **Total Weight Lifted (kg):** Your combined total from the squat, bench press, and deadlift.\n- **BW:** Your body weight in kilograms.\n- **a, b, c, d, e:** Coefficients derived from statistical modeling to ensure accurate scaling across various body weights.\n\nThese coefficients are carefully designed to balance the advantage heavier lifters might have in absolute strength and the lighter lifters\u2019 advantage in relative strength.\n\n```rust\nuse crate::poly4;\nuse opltypes::*;\n\npub fn dots_coefficient_men(bodyweightkg: f64) -> f64 {\n    const A: f64 = -0.0000010930;\n    const B: f64 = 0.0007391293;\n    const C: f64 = -0.1918759221;\n    const D: f64 = 24.0900756;\n    const E: f64 = -307.75076;\n\n    // Bodyweight bounds are defined; bodyweights out of range match the boundaries.\n    let adjusted = bodyweightkg.clamp(40.0, 210.0);\n    500.0 / poly4(A, B, C, D, E, adjusted)\n}\n\npub fn dots_coefficient_women(bodyweightkg: f64) -> f64 {\n    const A: f64 = -0.0000010706;\n    const B: f64 = 0.0005158568;\n    const C: f64 = -0.1126655495;\n    const D: f64 = 13.6175032;\n    const E: f64 = -57.96288;\n\n    // Bodyweight bounds are defined; bodyweights out of range match the boundaries.\n    let adjusted = bodyweightkg.clamp(40.0, 150.0);\n    500.0 / poly4(A, B, C, D, E, adjusted)\n}\n\n/// Calculates Dots points.\n///\n/// Dots were introduced by the German IPF Affiliate BVDK after the IPF switched to\n/// IPF Points, which do not allow comparing between sexes. The BVDK hosts team\n/// competitions that allow lifters of all sexes to compete on a singular team.\n///\n/// Since Wilks points have been ostracized from the IPF, and IPF Points are\n/// unsuitable, German lifters therefore came up with their own formula.\n///\n/// The author of the Dots formula is Tim Konertz <tim.konertz@outlook.com>.\n///\n/// Tim says that Dots is an acronym for \"Dynamic Objective Team Scoring,\"\n/// but that they chose the acronym before figuring out the expansion.\npub fn dots(sex: Sex, bodyweight: WeightKg, total: WeightKg) -> Points {\n    if bodyweight.is_zero() || total.is_zero() {\n        return Points::from_i32(0);\n    }\n    let coefficient: f64 = match sex {\n        Sex::M | Sex::Mx => dots_coefficient_men(f64::from(bodyweight)),\n        Sex::F => dots_coefficient_women(f64::from(bodyweight)),\n    };\n    Points::from(coefficient * f64::from(total))\n}\n```\n\n## IPF Good Lift Coefficient\n\nThe **IPF Good Lift Coefficient** calculator computes the comparative weight coefficient between weight lifters based on the weight of the lifter (x), the type of lift and the gender of the lifter, all combined in the IPF GL Coefficient formula. Information about this is from [IPF](https://www.powerlifting.sport/fileadmin/ipf/data/ipf-formula/IPF_GL_Coefficients-2020.pdf).\n\n**INSTRUCTIONS:** Choose units and enter the following:\n\n- (**x**)  Weigh of Person\n- (**g**) Gender of Person\n- (LT) lift type\n  - Equipped Power Lift\n  - Classic Power Lift\n  - Equipped Bench Press\n  - Classic Bench Press\n\n**IPFL GL Coefficient (IPC):** The calculator returns the coefficient as a real number (decimal).\n\n### The Math / Science\n\nThe International Powerlifting Federation GL coefficient formula is:\n\n  IPC=100A\u2212B\u22c5e\u2212C\u22c5BWT\n\nwhere:\n\n- IPC = IPF GL coefficient\n- BWT = body weight of the lifter\n- A, B, C = f(gender, lift type), see below\n\n\n\n```rust\nuse opltypes::*;\n\n/// Hardcoded formula parameters: `(A, B, C)`.\ntype Parameters = (f64, f64, f64);\n\n/// Gets formula parameters from what is effectively a lookup table.\nfn parameters(sex: Sex, equipment: Equipment, event: Event) -> Parameters {\n    // Since the formula was made for the IPF, it only covers Raw and Single-ply.\n    // We do our best and just reuse those for Wraps and Multi-ply, respectively.\n    let equipment = match equipment {\n        Equipment::Raw | Equipment::Wraps | Equipment::Straps => Equipment::Raw,\n        Equipment::Single | Equipment::Multi | Equipment::Unlimited => Equipment::Single,\n    };\n\n    // Points are only specified for Sex::M and Sex::F.\n    let dichotomous_sex = match sex {\n        Sex::M | Sex::Mx => Sex::M,\n        Sex::F => Sex::F,\n    };\n\n    const SBD: Event = Event::sbd();\n    const B: Event = Event::b();\n\n    match (event, dichotomous_sex, equipment) {\n        (SBD, Sex::M, Equipment::Raw) => (1199.72839, 1025.18162, 0.009210),\n        (SBD, Sex::M, Equipment::Single) => (1236.25115, 1449.21864, 0.01644),\n        (SBD, Sex::F, Equipment::Raw) => (610.32796, 1045.59282, 0.03048),\n        (SBD, Sex::F, Equipment::Single) => (758.63878, 949.31382, 0.02435),\n\n        (B, Sex::M, Equipment::Raw) => (320.98041, 281.40258, 0.01008),\n        (B, Sex::M, Equipment::Single) => (381.22073, 733.79378, 0.02398),\n        (B, Sex::F, Equipment::Raw) => (142.40398, 442.52671, 0.04724),\n        (B, Sex::F, Equipment::Single) => (221.82209, 357.00377, 0.02937),\n\n        _ => (0.0, 0.0, 0.0),\n    }\n}\n\n/// Calculates IPF GOODLIFT Points.\npub fn goodlift(\n    sex: Sex,\n    equipment: Equipment,\n    event: Event,\n    bodyweight: WeightKg,\n